{
  "schema": {
    "tables": [
      {
        "name": "Booking",
        "primaryKey": "id",
        "columns": {
          "id": "UUID",
          "room_id": "UUID",
          "start_date": "DATE",
          "end_date": "DATE"
        }
      },
      {
        "name": "Customer",
        "primaryKey": "id",
        "columns": {
          "id": "UUID",
          "name": "TEXT",
          "email": "CITEXT",
          "country": "TEXT?",
          "orders": {
            "collection": "Order",
            "foreignKey": "customer_id"
          }
        }
      },
      {
        "name": "Order",
        "primaryKey": "id",
        "columns": {
          "id": "UUID",
          "customer": {
            "ref": "Customer",
            "foreignKey": "customer_id"
          },
          "status": "TEXT",
          "total": "DECIMAL"
        }
      }
    ]
  },
  "rule": {
    "recordTable": "Booking"
  },
  "record": {
    "id": "b-1",
    "room_id": "room-7",
    "start_date": "2026-10-01",
    "end_date": "2026-10-05"
  },
  "data": {
    "responses": [
      {
        "match": "EXISTS",
        "value": false
      },
      {
        "match": "GROUP BY",
        "rows": [
          {
            "customer_name": "Ada Lovelace",
            "total_spent": 4820.5,
            "order_count": 12
          },
          {
            "customer_name": "Grace Hopper",
            "total_spent": 3180.0,
            "order_count": 9
          }
        ]
      }
    ]
  }
}
