{
  "schema": {
    "tables": [
      {
        "name": "Customer",
        "primaryKey": "id",
        "columns": {
          "id": "UUID",
          "orders": {
            "collection": "Order",
            "foreignKey": "customer_id"
          }
        }
      },
      {
        "name": "Order",
        "primaryKey": "id",
        "columns": {
          "id": "UUID",
          "status": "TEXT",
          "total": "DECIMAL"
        }
      }
    ]
  },
  "rule": {
    "recordTable": "Customer"
  },
  "record": {
    "id": "c-1"
  },
  "data": {
    "responses": [
      {
        "rows": [
          {
            "id": "o-1",
            "status": "shipped",
            "total": 300.25
          },
          {
            "id": "o-2",
            "status": "open",
            "total": 400
          },
          {
            "id": "o-3",
            "status": "shipped",
            "total": 0
          },
          {
            "id": "o-4",
            "status": "shipped",
            "total": 250
          }
        ]
      }
    ]
  }
}
